{
  "release": {
    "schema_version": "1.0.0",
    "data_version": "2026.10.08-common-hippo-1",
    "engine_version": "1.0.0",
    "build_date": "2026-10-08",
    "provenance": "Public-source import bundle from official zoo, zoo-association, conservation, and zoological-society publications; named records and directly stated relationships only. See docs/HIPPOPOTAMUS_COMMON_SOURCES.md and reports/common-hippo-import.json."
  },
  "coverage": {
    "taxon": "Hippopotamus amphibius",
    "scope": "Selected individually named common hippos and directly documented parentage across Cincinnati, San Diego, Prague, Budapest, Ostrava, Japanese zoos, Berlin and London.",
    "limitations": [
      "Selected named Hippopotamus amphibius from public zoo, conservation and research publications; not a complete census or pedigree.",
      "Parentage is included only where a cited source directly identifies the parent. Unknown fathers, unnamed calves, cohabitation and ambiguous counts do not create nodes or parent edges.",
      "Ostrava records come from a public historical chapter in its 2009 annual report. The full European studbook is separately keeper-requested; no studbook numbers or restricted records are copied, and no report reuse license is asserted.",
      "The Japanese common-hippo studbook is also keeper-requested. This import uses named public zoo pages and does not reproduce studbook records.",
      "Historical living status and incomplete dates remain unknown or approximate. No animal photos, image files or direct image URLs are included."
    ],
    "last_reviewed": "2026-10-08",
    "source_categories": [
      "official zoo announcements and biographies",
      "official zoo annual reports and historical chapters",
      "official zoo newsletters and magazines",
      "specialist group and zoo association publications"
    ],
    "translations": {
      "ja": {
        "scope": "Cincinnati、San Diego、Prague、Budapest、Ostrava、日本、Berlin、Londonの公開資料にあるカバの個体名と直接確認可能な親子関係。",
        "limitations": [
          "公開動物園・保全・研究資料に基づくHippopotamus amphibiusの個体選定であり、完全な一覧や血統台帳ではありません。",
          "親子関係は出典が親を直接示す場合のみ記録します。父親不明、無名の子、同居、曖昧な集計から記録を作成していません。",
          "Ostravaの記録は2009年年次報告書の公開歴史章によります。完全な欧州血統台帳は管理者への請求が必要で、番号や制限記録を複製せず、報告書の再利用許諾も主張しません。",
          "日本のカバ血統台帳も管理者への請求が必要です。このインポートは公開動物園ページのみを利用します。",
          "歴史的な生存状況や不完全な日付は不明または概算のままです。写真や画像URLは含みません。"
        ]
      },
      "ru": {
        "scope": "Именованные обыкновенные бегемоты и прямо подтверждённое родство из публичных материалов Cincinnati, San Diego, Prague, Budapest, Ostrava, Японии, Berlin и London.",
        "limitations": [
          "Выборка Hippopotamus amphibius из общедоступных публикаций зоопарков и природоохранных организаций; это не полный каталог или родословная.",
          "Родство включено только при прямом указании в источнике. Неизвестные отцы, безымянные детёныши, совместное содержание и неоднозначные подсчёты не создают записи.",
          "Данные Ostrava взяты из открытой исторической главы годового отчёта за 2009 год. Полная европейская племенная книга предоставляется по запросу куратору; номера и закрытые записи не копируются, лицензия на повторное использование отчёта не заявляется.",
          "Японская племенная книга также доступна по запросу куратору. Используются только опубликованные страницы зоопарков.",
          "Исторический статус и неполные даты остаются неизвестными или приблизительными. Фотографии и URL изображений не включены."
        ]
      }
    }
  },
  "animals": [
    {
      "id": "hippopotamus-common-animal-cin-bibi",
      "taxon": "Hippopotamus amphibius",
      "sex": "female",
      "status": "unknown",
      "name": {
        "canonical": "Bibi",
        "language": "en",
        "source_ids": [
          "hippopotamus-common-source-cin-fiona",
          "hippopotamus-common-source-cin-fritz",
          "hippopotamus-common-source-cin-fiona-blog"
        ],
        "localized": []
      },
      "aliases": [],
      "external_ids": [],
      "review": {
        "status": "reviewed",
        "reviewed_on": "2026-10-08",
        "notes": "Name and available sex/status evidence are source-linked; unverified current status remains unknown."
      }
    },
    {
      "id": "hippopotamus-common-animal-cin-henry",
      "taxon": "Hippopotamus amphibius",
      "sex": "male",
      "status": "deceased",
      "name": {
        "canonical": "Henry",
        "language": "en",
        "source_ids": [
          "hippopotamus-common-source-cin-fiona",
          "hippopotamus-common-source-cin-henry"
        ],
        "localized": []
      },
      "aliases": [],
      "external_ids": [],
      "review": {
        "status": "reviewed",
        "reviewed_on": "2026-10-08",
        "notes": "Name and available sex/status evidence are source-linked; unverified current status remains unknown."
      }
    },
    {
      "id": "hippopotamus-common-animal-cin-fiona",
      "taxon": "Hippopotamus amphibius",
      "sex": "female",
      "status": "unknown",
      "name": {
        "canonical": "Fiona",
        "language": "en",
        "source_ids": [
          "hippopotamus-common-source-cin-fiona",
          "hippopotamus-common-source-cin-birth"
        ],
        "localized": []
      },
      "aliases": [],
      "external_ids": [],
      "review": {
        "status": "reviewed",
        "reviewed_on": "2026-10-08",
        "notes": "Name and available sex/status evidence are source-linked; unverified current status remains unknown."
      }
    },
    {
      "id": "hippopotamus-common-animal-cin-tucker",
      "taxon": "Hippopotamus amphibius",
      "sex": "male",
      "status": "unknown",
      "name": {
        "canonical": "Tucker",
        "language": "en",
        "source_ids": [
          "hippopotamus-common-source-cin-tucker",
          "hippopotamus-common-source-cin-fritz"
        ],
        "localized": []
      },
      "aliases": [],
      "external_ids": [],
      "review": {
        "status": "reviewed",
        "reviewed_on": "2026-10-08",
        "notes": "Name and available sex/status evidence are source-linked; unverified current status remains unknown."
      }
    },
    {
      "id": "hippopotamus-common-animal-cin-fritz",
      "taxon": "Hippopotamus amphibius",
      "sex": "male",
      "status": "unknown",
      "name": {
        "canonical": "Fritz",
        "language": "en",
        "source_ids": [
          "hippopotamus-common-source-cin-fritz",
          "hippopotamus-common-source-cin-2024"
        ],
        "localized": []
      },
      "aliases": [],
      "external_ids": [],
      "review": {
        "status": "reviewed",
        "reviewed_on": "2026-10-08",
        "notes": "Name and available sex/status evidence are source-linked; unverified current status remains unknown."
      }
    },
    {
      "id": "hippopotamus-common-animal-sd-funani",
      "taxon": "Hippopotamus amphibius",
      "sex": "female",
      "status": "living",
      "name": {
        "canonical": "Funani",
        "language": "en",
        "source_ids": [
          "hippopotamus-common-source-sd-devi",
          "hippopotamus-common-source-sd-family",
          "hippopotamus-common-source-sd-amahle",
          "hippopotamus-common-source-sd-moon",
          "hippopotamus-common-source-sd-current"
        ],
        "localized": []
      },
      "aliases": [],
      "external_ids": [],
      "review": {
        "status": "reviewed",
        "reviewed_on": "2026-10-08",
        "notes": "Name and available sex/status evidence are source-linked; unverified current status remains unknown."
      }
    },
    {
      "id": "hippopotamus-common-animal-sd-otis",
      "taxon": "Hippopotamus amphibius",
      "sex": "male",
      "status": "unknown",
      "name": {
        "canonical": "Otis",
        "language": "en",
        "source_ids": [
          "hippopotamus-common-source-sd-family"
        ],
        "localized": []
      },
      "aliases": [],
      "external_ids": [],
      "review": {
        "status": "reviewed",
        "reviewed_on": "2026-10-08",
        "notes": "Name and available sex/status evidence are source-linked; unverified current status remains unknown."
      }
    },
    {
      "id": "hippopotamus-common-animal-sd-devi",
      "taxon": "Hippopotamus amphibius",
      "sex": "female",
      "status": "unknown",
      "name": {
        "canonical": "Devi",
        "language": "en",
        "source_ids": [
          "hippopotamus-common-source-sd-devi"
        ],
        "localized": []
      },
      "aliases": [],
      "external_ids": [],
      "review": {
        "status": "reviewed",
        "reviewed_on": "2026-10-08",
        "notes": "Name and available sex/status evidence are source-linked; unverified current status remains unknown."
      }
    },
    {
      "id": "hippopotamus-common-animal-sd-tony",
      "taxon": "Hippopotamus amphibius",
      "sex": "male",
      "status": "unknown",
      "name": {
        "canonical": "Tony",
        "language": "en",
        "source_ids": [
          "hippopotamus-common-source-sd-tony-name",
          "hippopotamus-common-source-sd-tony-sex",
          "hippopotamus-common-source-sd-family"
        ],
        "localized": []
      },
      "aliases": [],
      "external_ids": [],
      "review": {
        "status": "reviewed",
        "reviewed_on": "2026-10-08",
        "notes": "Name and available sex/status evidence are source-linked; unverified current status remains unknown."
      }
    },
    {
      "id": "hippopotamus-common-animal-sd-amahle",
      "taxon": "Hippopotamus amphibius",
      "sex": "female",
      "status": "living",
      "name": {
        "canonical": "Amahle",
        "language": "en",
        "source_ids": [
          "hippopotamus-common-source-sd-amahle",
          "hippopotamus-common-source-sd-moon",
          "hippopotamus-common-source-sd-current"
        ],